{
  "receipt_id": "receipt-example-deny-001",
  "transition_id": "transition-example-002",
  "layer_id": "stegverse-transition-admissibility",
  "issued_at_utc": "2026-06-18T00:00:00Z",
  "admissibility_result": "DENY",
  "authority_class": {
    "class_id": "insufficient-authority",
    "source": "StegVerse hypothetical governance boundary",
    "scope": "transition admissibility within declared StegVerse layer scope",
    "delegation_chain": [
      "StegVerse",
      "StegCore",
      "stegverse-transition-admissibility"
    ],
    "assertion_boundaries": [
      "layer-scoped",
      "commit-time-bound",
      "authority basis insufficient at commit time"
    ],
    "external_validation_required": true
  },
  "policy_reference": {
    "policy_id": "policy-example-transition-boundary",
    "policy_version": "0.1.0-hypothetical",
    "source": "StegCore GLM boundary example",
    "scope": "commit-time denial example",
    "retained_reference": true,
    "reference_uri": "docs/glm/STEGVERSE_GLM_BOUNDARY_NOTE.md",
    "non_claims": [
      "This example does not prove upstream falsity.",
      "This example only records the StegVerse layer's scoped denial."
    ]
  },
  "review_posture": "external_review_required",
  "commit_time_validity": {
    "valid_at_commit": false,
    "commit_time_utc": "2026-06-18T00:00:00Z",
    "failure_reason": "The asserted authority class did not satisfy the declared transition boundary at commit time."
  },
  "visible_context": {
    "transition_request_present": true,
    "authority_class_visible": true,
    "policy_reference_visible": true,
    "receipt_structure_visible": true,
    "authority_gap_visible": true
  },
  "external_assumptions": [
    "Upstream evidence may later be supplemented.",
    "External review may alter organizational interpretation outside this layer.",
    "This denial does not decide downstream legal status."
  ],
  "non_claims": [
    "This receipt does not claim universal inadmissibility.",
    "This receipt does not prove that every upstream source was invalid.",
    "This receipt does not create authority inheritance."
  ],
  "replay_materials": [
    {
      "name": "transition manifest",
      "available": true,
      "reference": "glm/layers/transition-admissibility.glm.json"
    },
    {
      "name": "boundary note",
      "available": true,
      "reference": "docs/glm/STEGVERSE_GLM_BOUNDARY_NOTE.md"
    }
  ]
}
